Date,From,To,Subject,Message
"Fri, 28 Dec 2001 07:14:26 -0800 (PST)",shona.wilson@enron.com,"chris.abel@enron.com, naveen.andrews@enron.com, beth.apollo@enron.com,",DPR reporting,"Plans for the reporting of the consolidated DPR are:

For trading date Friday, December 28th - No DPR
For trading date Monday, December 31st - Our goal is to publish this in preliminary form by the end of the day Monday, 1/1/02.

Please call me if you have questions or comments about this reporting schedule.

I wish you all a happy New Year."
