Date,From,To,Subject,Message
"Tue, 20 Nov 2001 13:20:08 -0800 (PST)",foster.smith@elpaso.com,mike.maggi@enron.com,,"You want to get a quick drink around 4:30?


******************************************************************
This email and any files transmitted with it from the ElPaso
Corporation are confidential and intended solely for the
use of the individual or entity to whom they are addressed.
If you have received this email in error please notify the
sender.
******************************************************************"
