Date,From,To,Subject,Message
"Mon, 26 Nov 2001 12:25:49 -0800 (PST)",john.j.stauffacher@dynegy.com,"dan.king@dynegy.com, betsy.carr@dynegy.com, chris.russo@dynegy.com",Merger data request-Texas update,"Attached is an updated generation market share analysis for Dynegy/Enron--
data now reflects the net dependable summer capacity for the operational
facilities (this is the standard called for by PUCT rules for market share
analysis)--it does vary slightly from the nameplate capacity used
elsewhere.  Enron ownership subject to change if filing is not emanate.


(See attached file: Dynegy Enron ERCOT Generation market share.doc)"
