Date,From,To,Subject,Message
"Wed, 6 Feb 2002 18:32:52 -0800 (PST)",fm@monthlydrawing.roi1.net,dutch.quigley@enron.com,"""We FOUND your MONEY"", Oprah Winfrey Show?","[IMAGE]   [IMAGE] [IMAGE]  [IMAGE] [IMAGE]    FoundMoney  is here to help y=
ou locate and claim your lost CASH. And the amount on that check, OR MORE, =
literally be YOURS for the claiming.      This is not a contest or a promot=
ion. FoundMoney  is a search service dedicated to putting UNCLAIMED MONEY t=
ogether with its rightful owners.    [IMAGE] [IMAGE]    There are 31 millio=
n North American people eligible right now to claim unknown cash windfalls.=
 The search is Fast, Easy and GAURANTEED    Over $7 BILLION is sitting in o=
ur database alone, which contains bank and government accounts, wills and e=
states, insurance settlements etc.    [IMAGE] [IMAGE]      Since 1994, our =
Web site has reunited millions upon millions of dollars with thousands of r=
ightful owners -- who didn't even know  they had money waiting for them.   =
 Click here  NOW or on the link below to find out -- in seconds -- if there=
 is money waiting to be claimed in your family name or that of somebody you=
 know. The INITIAL SEARCH IS FREE.    YOU HAVE NOTHING TO LOSE ....  TRY FO=
UNDMONEY TODAY   CLICK HERE NOW!"
