Date,From,To,Subject,Message
"Thu, 17 Jan 2002 07:28:39 -0800 (PST)",duong.luu@enron.com,"a..allen@enron.com, r..brackett@enron.com, s..theriot@enron.com,",EnPower NETCO production - TESTING,"All,

Please feel free to test enpower NETCO production and we will truncate deal data later.
If you found problems or comments, please let us know asap.


Windows 2000 Shortcut for enpower NETCO production
 

EnPower Launchpad for NETCO production
 

EnPower Report Launcher for Contract Settlements Group
 

EnPower Report Launcher for Credit Group
 

EnPower Report Launcher for Deal Clearing Group
 

EnPower Report Launcher for Risk Group
 

EnPower Report Launcher for Scheduling Group
 

EnPower Launchpad File Menu
 

EnPower Launchpad Tools Menu
 

EnPower Launchpad Downloads Menu"
