Date,From,To,Subject,Message
"Sat, 22 Oct 0001 12:49:40 -0800 (PST)",enron_update@concureworkplace.com,skean@enron.com,<<Concur Expense Document>> - Robert L. Bradley,"The following expense report is ready for approval:

Employee Name: Robert L. Bradley Jr
Status last changed by:  Automated Administrator
Expense Report Name: Robert L. Bradley
Report Total: $1,837.06
Amount Due Employee: $1,837.06


To approve this expense report, click on the following link for Concur Expense.
http://expensexms.enron.com"
