Date,From,To,Subject,Message
"Wed, 29 Aug 2001 00:45:33 -0700 (PDT)",support@mail.sportsbook.com,lcampbel@enron.com,Football Bonus Specials From Sportsbook.com,"[IMAGE]  [IMAGE]   10% Special For Football   Sportsbook.com is ready fo=
r you this September. We're giving every member a 10% cash bonus on EVERY d=
eposit you make between September 1st to the 15th.   We Give You the Edge  =
 Every Friday, there's a 5% juice special, and our featured college game is=
 even money.   Add in your 10% bonus, and you have the edge.  Do the math. =
  Double Your Money Every Monday   We're running our world famous double yo=
ur money contest again this year.  Place a bet on Monday Night's Football g=
ame, click on the Double Your Money icon, guess the score of the game, and =
if you're correct, we'll double your winnings.  Best of all, it's free.   M=
ore Benefits And Features   NCAA  and NFL Season Total Bets.    Our Week On=
e Odds are already up.  Click here.   The Most Prop Bets on the Internet. C=
lick here.   Win $2,000 Daily in our Free Pick 4 Contest.   Rock Solid Stab=
ility, See our Stock Price here.   24/7 365 days a year, live customer supp=
ort.  New, easy, ATM withdrawals.    What are you waiting for?  Get in the =
Game at Sportsbook.com    Superbowl Futures    Chicago Bears 200-1  [IMAGE]=
 Tennessee Titans 8-1  [IMAGE] St. Louis Rams 5-1  [IMAGE] Oakland Raiders =
10-1  [IMAGE] New York Giants 30-1  [IMAGE] Indianapolis Colts 15-1  [IMAGE=
] Baltimore Ravens 5-1  [IMAGE]  [IMAGE]   [IMAGE]"
