Date,From,To,Subject,Message
"Wed, 29 Aug 2001 14:08:15 -0700 (PDT)",messenger@smartreminders.com,lcampbel@enron.com,Tell me where to send your 24-Piece Tool Kit,"[IMAGE]
[IMAGE][IMAGE][IMAGE]=20
Dear  SmartReminders Member,
We've partnered with  the American Homeowners Association to bring you this=
 special offer:
=09    =09
   [IMAGE]   Dear Friend, I have your deluxe 24-Piece Tool Kit  from the Am=
erican Homeowners Association.  It's FREE. But I need to know where to send=
 it. Click Here   and complete the form within the next 48 hours so I can s=
hip it to you immediately.    It's handy for your house or car, and it make=
s a great gift. Plus you can  try all of our money-saving membership benefi=
ts FREE for  a full month. Act  Now    [IMAGE]   Because of our massive nat=
ionwide  buying power, we're able to negotiate ultra deep discounts  for ou=
r members. You  can instantly:  - save up to 66% on tools, electronics, gif=
ts, clothes, and more. - fly anywhere for the guaranteed lowest ticket pric=
e. - stay at top hotels and resorts worldwide for half price. - cut your in=
surance rates by 15% for your home and car. - get free access to over 50,00=
0 money-saving grocery coupons.  Try AHA and experience the benefits for yo=
urself. Our members save on repairs, insurance, groceries,  special vacatio=
n deals, and more than twenty other member benefits, and get a  FREE subscr=
iption to HOME Magazine  included!     This offer is risk-free , registrati=
on only takes a minute and is completely secure.  It's that easy. Your sati=
sfaction is guaranteed because our credibility is on the line."
