Date,From,To,Subject,Message
"Mon, 23 Apr 2001 11:53:21 -0700 (PDT)",stephanie.sever@enron.com,kevin.ruscitti@enron.com,EnronOnline Desk to Desk Id and Password,"Kevin,

The Firm Trading Central book has been set up as an internal counterparty for desk-to-desk trading on EnronOnline. 


The following User ID and Password will give you access to live prices on the web-site http://www.enrononline.com.

User ID:	ADM09529
Password:	WELCOME!


(note these are case sensitive)



Please keep your User ID and Password secure as this allows you to transact on EnronOnline.

Contact the helpdesk at x34357 if you have any questions or problems gaining access with this ID."
