Date,From,To,Subject,Message
"Tue, 3 Feb 2004 18:14:47 -0800 (PST)",hotwebcash@lists.adversend.com,m..presto@enron.com,"Get a $5,000 Credit Limit!","Get Approved for an Unsecured Gold Credit Card Instantly Online! <http://r1.adversend.com/?u=319&l=5&id=4199108>


Get Approved for an Unsecured Gold Credit Card Instantly Online! <http://r1.adversend.com/?u=319&l=5&id=4199108> 

Now you can get Guaranteed instant online Approval for an Unsecured Gold Credit Card with a $5,000 credit line. That's right!!! As long as you are at least 18, a U.S resident with at least $800 in monthly household income and are not currently in bankruptcy, your APPROVAL IS GUARANTEED! Enjoy great merchandise while improving your credit because the USA Gold Card reports your good credit to all three major bureaus. 

We want to help you establish or reestablish your credit today! 


Don't wait any longer - Apply Online Today and get the credit you deserve!  <http://r1.adversend.com/?u=319&l=5&id=4199108>"
