Date,From,To,Subject,Message
"Tue, 6 Nov 2001 11:46:38 -0800 (PST)","Westbrook, Sharron","Beck, Sally; Becker, Melissa; Butts, Bob; Castleman, Kent; Colwell, Wes; Dyson, Fernley; Fabian, Beverly; Faldyn, Rodney; Hayslett, Rod; Hermann, Robert; Lindholm, Tod A.; Lindsey, Mark E.; Marlow, Keith; Parsons, Andrew; Price, Brent A.; Roper, Kerry; Saunders, James; Selzer, Howard; Sommer, Allan; Sommers, Jeffrey E.; Stubblefield, Wade; Wasaff, George",STAFF MEETING,"should i be attending these?

i couldn't this AM due to clean fuels and nng/ tw urgencies

anything newsworthy from rick?

 -----Original Message-----
From: 	Westbrook, Sharron  
Sent:	Monday, November 05, 2001 3:22 PM
To:	Beck, Sally; Becker, Melissa; Butts, Bob; Castleman, Kent; Colwell, Wes; Dyson, Fernley; Fabian, Beverly; Faldyn, Rodney; Hayslett, Rod; Hermann, Robert; Lindholm, Tod A.; Lindsey, Mark E.; Marlow, Keith; Parsons, Andrew; Price, Brent A.; Roper, Kerry; Saunders, James; Selzer, Howard; Sommer, Allan; Sommers, Jeffrey E.; Stubblefield, Wade; Wasaff, George
Cc:	Alvarez, Gloria; Bryan, Jennifer; Campos, Kathy; Dennard, Virginia; Escamilla, Grisela; Gray, Dortha; Hawkins, Linda; Karsolich, Regina; Lewelling, Sandy; Moody, Bobbie; Myer, Karen; Petry, Norma; Reyes, Sonnia; Rodriguez, Dawn; Scott, Nicole; Taylor, Darlene; Tijerina, Shirley; Valdez, Christina; Villanueva, Chantelle; Wadsworth, Sue; Weldon, Kim
Subject:	STAFF MEETING

RICK WANTS TO HAVE HIS STAFF MEETING TOMORROW.  IT WILL BE HELD AT 8:30 IN THE BOARDROOM."
