Date,From,To,Subject,Message
"Wed, 19 Dec 2001 08:59:31 -0800 (PST)","Herod, Brenda F.","Breese, Mark; Cross, Edith; Furrow, Dale; Aucoin, Berney C. ; Maynard, Michelle; Sharp, Vicki",REJECTION MOTION UPDATE,"To confirm earlier conversations and associated action items with respect to PECO Physical Customers (listed below on spreadsheet):

(1)	W/ Brenda: Rejection lists for PJM currently include Cheltenham (Simon) and Lehigh Valley Dairies (Suiza).  These will be pulled from the PJM list.  Suiza is already accounted for on the GNO reject list, Simon is currently not on the reject list (status is pending).
(2)	Jim Steffes: On point for letter to PECO to indicate that we would not object to placing these 15 sites on bundled POLR service.
(3)	Michelle: Has confirmed that DeDASR action for contracts not on reject list (Simon and Macerich) will not affect rights under contract (this would merely represent exercise of EES supply option).
(4)	Next Step: Evan-since all of the contracts here are either on reject list, or are associated with Simon/Macerich (which will not be affected by D-DASR action) we need to initiate DeDASR activities for all 15 sites immediately after our motion to reject the first batch of contracts is filed."
