Date,From,To,Subject,Message
"Fri, 18 Jan 2002 11:07:18 -0800 (PST)",julie.clyatt@enron.com,sally.beck@enron.com,The e-mail went out to these people -,"Tripp, Garrett; Garcia, Paul; Hart, Reginald; Brackett, Debbie R.; Bradford=
, William S.; Conwell, Wendy; Gil, Mercy; Mcginnis, Stephanie; Nelson, Rode=
rick; Reasoner, Monica; Rohauer, Tanya; Sacks, Edward; Sonnonstine, Max; Wi=
lliams, Jason R (Credit); Anderson, Bridgette; Anderson, Diane; Campos, Ant=
hony; Campos, Sylvia A.; Cason, Sharen; Denton, Rhonda L.; Elledge, Susan; =
Fischer, Jason; Hare, Bill D.; Hunter, Larry Joe; Indelicato, Kimberly; Met=
oyer, Evelyn; Murphy, Melissa; Neuner, Dale; Neves, Brenna; Piwetz, Stephan=
ie; Richardson, Stacey; Theriot, Kim S.; Bailey, Derek; Estrada, Israel; Br=
uce, Michelle; Wallumrod, Ellen; Aune, Stacey A.; Beltri, Angeles; Brown, S=
arah; Colwell, Wes; Day, Misti; Eastwood, Anne; Ellis, Kelly; Greene, Tracy=
; Gruesen, Karen; Guerra, Ricardo; Harris, Kim; Harris, Paula; Hodges, Geor=
geanne; Irvin, Tracey; Kacal, Lynna; Killen, Faith; Leschber, Edie; Lo, Con=
nie; Longoria, Jennifer K.; McPearson, Shannon; Moore, Mary Kay; Schultz, A=
manda; Shepperd, Tammy R.; Simper, Keith; Smith, Jennifer L.; Tijerina, Shi=
rley; Vandor, David; Warwick, Todd; Whiting, Greg; Wolfe, Stephen; Becker, =
Lorraine; Rosado, Jennifer; Estrada, Mercedes E.; James, Giselle; Weatherst=
one, Mary; Burnham, Steven; Oh, Grant; Brodeur, Stephane"
