Date,From,To,Subject,Message
"Wed, 24 Oct 2001 11:10:44 -0700 (PDT)",craig.buehler@enron.com,darrell.schoolcraft@enron.com,Texas Monthly November 2001: How Enron Blew It,"How Enron Blew It
Less than a year ago, the Houston-based energy behemoth had everything: mon=
ey, power, glitz, smarts, new ideas, and a CEO who wanted to make it the mo=
st important company in the world. Now its stock is down, wall street is be=
arish, and the CEO is gone. What went wrong?
by Mimi Swartz </mag/issues/authors/mimiswartz.php>
THE ENRON SKYSCRAPER NEAR THE SOUTH END OF HOUSTON'S DOWNTOWN feels like th=
e international headquarters of the best and the brightest. The lobby in no=
 way resembles the hushed, understated entryways of the old-fashioned oil c=
ompanies, like Shell and Texaco nearby. Enron, in contrast, throbs with mod=
ernity. The people hustling in and out of the elevators are black, white, b=
rown; Asian, Middle Eastern, European, African, as well as American-born. T=
hey are young, mostly under 35, and dressed in the aggressively casual unif=
orm of the tech industry-the guys wear khakis, polo shirts, and Banana Repu=
blic button-downs. Almost preposterously fit, they move through the buildin=
g intently, like winners. Enron is nothing if not energetic: A Big Brother-=
size TV screen frantically reports on the stock market near a bank of eleva=
tors, while another hefty black television relaying the same news greets pe=
ople entering from the garage. A sculpture of the corporate symbol, an E ti=
pped at a jaunty angle, radiates colors as it spins frenetically on its axi=
s; a Starbucks concession on the ground floor keeps everyone properly caffe=
inated. Multicolored, inspirational flags hang from the ceiling, congratula=
ting Enron on its diversity and its values; one more giant banner between e=
levator banks declares Enron's simple if grandiose goal: ""From the World's =
Leading Energy Company to . . . The World's Leading Company!""
For a while, that future seemed guaranteed, as Enron transformed itself fro=
m a stodgy, troubled pipeline company in 1985 to a trading colossus in 2000=
. It was a Wall Street darling, with a stock price that increased 1,700 per=
cent in that sixteen-year period, with revenues that increased from $40 bil=
lion to $100 billion. ""The very mention of the company in energy circles th=
roughout the world creates reactions ranging from paralyzing fear to envy,""=
 notes a 2001 report from Global Change Associates, a firm that provides ma=
rket intelligence to the energy business.
This Enron was largely the creation of Jeff Skilling, a visionary determine=
d to transform American business. Hired sixteen years ago as a consultant b=
y then-CEO Ken Lay, Skilling helped build a company that disdained the old =
formula of finding energy in the ground, hauling it in pipelines, and then =
selling it to refineries and other customers. Instead, it evolved into a co=
mpany that could trade and market energy in all its forms, from natural gas=
 to electricity, from wind to water. If you had a risky drilling venture, E=
nron would fund it for a piece of the action. If you wanted your megacorpor=
ation's energy needs analyzed and streamlined, Enron could do the job. If y=
ou were a Third World country with a pitiful infrastructure and burgeoning =
power needs, Enron was there to build and build. Basically, if an idea was =
new and potentially-and fantastically-lucrative, Enron wanted the first cra=
ck. And with each success, Enron became ever more certain of its destiny. T=
he company would be the bridge between the old economy and the high-tech wo=
rld, and in February of this year, Skilling reaped his reward when he succe=
eded Lay as chief executive officer. Enron, says Skilling, ""was a great mar=
riage of the risk-taking mentality of the oil patch with the risk-taking me=
ntality of the financial markets.""
The Enron story reflects the culture that drove American business at the en=
d of the twentieth century. Like the high-tech companies it emulated, Enron=
 was going to reinvent the American business model and, in turn, the Americ=
an economy. Maybe it was natural that this Brave New World also produced a =
culture that was based on absolutes: not just the old versus the new, but t=
he best versus the mediocre, the risk takers versus the complacent-those wh=
o could see the future versus those who could not. The key was investing in=
 the right kind of intellectual capital. With the best and the brightest, a=
 company couldn't possibly go wrong.
Or could it? Today Enron's stock trades at around $35, down from a high of =
$80 in January. The press cast Enron as the archvillain of California's ene=
rgy crisis last spring, and Skilling caught a blueberry pie in the face for=
 his relentless defense of the free market. A long-troubled power plant pro=
ject in India threatened the company's global ambitions. Telecommunications=
, in which Enron was heavily invested, imploded. Wall Street analysts who o=
nce touted the company questioned its accounting practices. Some of the cha=
nge in Enron's fortunes can be attributed to the economic downturn in uncer=
tain times that has afflicted all of American business. But the culture tha=
t the company created and lived by cannot escape blame.
ENRON, JEFF SKILLING SAYS, HAD ""a totally different way of thinking about b=
usiness-we got it."" At Enron, in fact, you either ""got it"" or you were gone=
-it was as simple as black and white. It is not coincidental, then, that th=
e color scheme of Skilling's River Oaks mansion mirrors the corporation he =
once headed. Here, the living room's white walls shimmer against the mahoga=
ny floors. Black leather trims the edge of snowy carpets. Billowy sofas set=
 off the jet-black baby grand. In the entry, white orchids cascade from a b=
lack vase on a black pedestal table that in turn pools onto cold, white mar=
ble. There is only one off-color note: After almost twenty years, Jeff Skil=
ling is no longer associated with Enron, having resigned abruptly after jus=
t six months as CEO. Once, Skilling was hailed as the next Jack Welch (Gene=
ral Electric's masterful CEO), as one of Worth magazine's best CEO's in Ame=
rica (anointed in 2001), and even as a daredevil who hosted the kind of unc=
hained adventure junkets in which, a friend told BusinessWeek, ""someone cou=
ld actually get killed."" Today, he sounds more like Ebenezer Scrooge on Chr=
istmas morning. ""I had no idea what I'd let go of,"" Skilling says of all th=
e personal sacrifices he made while retooling Enron.=20
From a black chair in the white library, across from a huge black and white=
 photograph of his daughter and two sons, Skilling clarifies. The demands o=
f working 24-7 for Enron caused him to ignore his personal finances. Divorc=
ed, he lived in a 2,200-square-foot house without a microwave or a dishwash=
er. He almost missed his brother's wedding. ""Learning a foreign language-I =
never learned a foreign language!"" he exclaims. He never once took his youn=
gest son to school. ""I'm interested in the kids. You don't do kids in fifte=
en-minute scheduling."" Travel: ""You can't go to Africa for a week and get a=
nything out of it!"" Skilling includes the study of architecture and design =
on his list of missed opportunities, then he stops and sighs. ""I'm not sure=
 that fulfillment in life is compatible with a CEO's job,"" he says, finally=
. Then his eyes lock on mine, and his voice, which had softened, regains it=
s pragmatic edge. ""It would have been easy to stay,"" he says. ""But that wou=
ld not have been good for me.""=20
He's a smallish, ruddy-faced man who keeps himself at fighting weight, hand=
some in the way of corporate titans, with piercing cheekbones and that assi=
duously stolid gaze. But the impatience Skilling once reserved for cautious=
 underlings and dull-witted utility company executives is now targeted at r=
eporters who have labeled his resignation ""bizarre"" and associates who are =
bitterly skeptical of his need for family time. His shrug stretches the lim=
its of his shimmering blue button-down, and his matching blue eyes look put=
 upon. ""I'm surprised,"" he says, ""that people have so much trouble understa=
nding this.""
PEOPLE WHO PASSED THROUGH DOWNTOWN HOUSTON in the late eighties or early ni=
neties couldn't help but notice a funny and, for its time, novel scene unfo=
lding throughout the workday at the base of the Enron Building. From nine t=
o five and before and after, you could see people slipping out of the prist=
ine silver skyscraper to smoke. They perched on the chrome banisters or lur=
ked near the glass doors at the entry, puffing like mad. They always looked=
 hurried and furtive, even ashamed. Whatever people knew about Enron in tho=
se days (and most people didn't know much), it was often associated with th=
at scene: Enron boasted one of the first nonsmoking corporate headquarters =
in Houston, and there couldn't have been clearer evidence of its break with=
 the energy world of the past. What macho engineer would have put up with s=
uch humiliation?
But this company was a child of another time, that period in the mid-eighti=
es when chaos enveloped the gas business. Federal deregulation of natural g=
as turned a steady, secure industry, in which gas pipeline companies freque=
ntly enjoyed a monopoly in portions of the areas that they served, into a v=
olatile free-for-all. The situation was compounded five years later by fede=
ral deregulation of the pipeline business. So it happened that a gentlemanl=
y gas pipeline company, Houston Natural Gas (HNG) found itself under attack=
 from Coastal Corporation, Oscar Wyatt's less than gentlemanly firm. HNG wa=
s then run by Lay, a sturdy, taciturn former economics professor and Transc=
o chief operating officer who had a passion for military strategy. (His doc=
toral thesis at the University of Houston was on supply and demand in the V=
ietnam War.) Lay, who was from Missouri and never succumbed-at least outwar=
dly-to Texas brashness, had done well enough:"
