Date,From,To,Subject,Message
"Mon, 21 May 2001 07:11:12 -0700 (PDT)",michelle.cash@enron.com,elizabeth.labanowski@enron.com,Re: Enron Law Conference,"Hi, Jim.

We had a great group of people working on the CLE committee this year.  The committee was a combination of people identified by the various general counsels, plus people I knew and thought would be reliable volunteers.  I believe that one of the current committee members would be a logical choice to chair next year's law conference CLE program.  (I know that I would have felt a little more confident had I sat on the committee before taking the helm).

Although most of the committee members contributed to the effort, any of  the following lawyers would be strong candidates to chair next year's CLE committee:  Carlos Sole, Rose Engeldorf, Michelle Hicks, Susan Scott, Marianne Castano, Brenda Funk, or Kriste Sullivan.  David Koogler, who was not an active member of the committee, but nonetheless was responsible for a speaker, also would be a good choice (in fact, for some reason, EBS is under the impression that it is next on the list, so David and Michelle would not be surprised if they were tapped for the job -- co-chairs may be a good idea).

Let me know if you have any questions or would like any more information on the committee or other aspects of the law conference CLE program.

As I mentioned in my voice mail, I enjoyed chairing the committee and"
