Date,From,To,Subject,Message
"Mon, 22 Oct 2001 16:36:14 -0700 (PDT)",coupon500@hotmail.com,"carlos@houstonbeat.com, howardkam@hotmail.com, samrep2@aol.com,",,"Friends:

As of last week, I am unemployed. I'm currently looking for a new job
possibly doing the same thing or maybe a sales/marketing for the college
industry. If yall hear of anything, please send it my way, I may be coming
back to Texas as well. I will let yall know and appreciate any help you may
give me. As I explore my options, I'll decide exactly what I'm looking for.


-Dustin L. Kalman

""What am I going to do with 40 subscriptions to Vibe?"" -Peter, Office Space


_________________________________________________________________
Get your FREE download of MSN Explorer at http://explorer.msn.com/intl.asp"
