Date,From,To,Subject,Message
"Thu, 13 Dec 2001 09:24:14 -0800 (PST)",hemery@firstunion1.com,hemery.houston_fannin1_po.central_dom@firstunion1.com,Online Account Access--Quicken Downlaod Now Available,"Now featuring the ability to download to Quicken or Money. 
Access Online has always provided you with a convenient way to monitor your investment accounts. Now we*ve enhanced it to give you real-time account information and quotes, the ability to download information to Quicken
 or Microsoft
 Money, product screeners, and much more. http://www.firstunionsec.com
		?	If you*re an existing Access Online client, you*ll soon be receiving new Access Codes to login to the new site. 
?	If you*re not currently using Access Online, now is the time to enroll your account - simply click on the *Enroll for Access Online* link at the left of the page(www.firstunionsec.com). 
?	You can also call and obtain your new access codes: 1-877-246-6976.
If you have any questions, or need help with your online services, please feel free to call me at 713-853-2407."
