Date,From,To,Subject,Message
"Wed, 25 Apr 2001 16:44:00 -0700 (PDT)",lafuze@enron.com,jeff.skilling@enron.com,,"Jeff--nice to see you at the bike ride on Saturday, and  to meet you at the=
 luncheon Monday honoring Jim Derrick. Thought you might be  interested in =
the report I prepared for people who pledged to MS in connection  with the =
bike ride over the weekend.
=20
Several persons  who have either pledged, or are considering a pledge, to t=
he National Multiple  Sclerosis Society have left messages or sent emails a=
sking if I am still alive  after the MS150 charity bike ride held this past=
 weekend. Others have asked for  a report of my experience. I am alive and =
sore. If you are not interested in the  report, please delete this email.
=20
First of all, for  those who have pledged or already sent you checks payabl=
e to the National  Multiple Sclerosis Society,"
